Headline,Mention Text,Link,Date,Source,Mentioned_brand,Reach,Likes,Comments
"Opay emerges as the only fintech with three wins at the 2025 BAFI awards","OPay was the only fintech to win three awards at the 2025 BAFI Awards, recognizing its role as a ""powerhouse of daily fintech activity"".",https://www.thecable.ng/opay-emerges-as-the-only-fintech-with-three-wins-at-the-2025-bafi-awards/,17/10/2025,The Cable,Opay,11000,,
"OPay unveils eighth security feature","OPay has unveiled its eighth security feature, ""Location Guard,"" as it continues its drive to ensure the protection of customers' funds.",https://punchng.com/tags/opay/,19/10/2025,Punch,Opay,133000,,
"Lagos State University joins beneficiaries of OPay's N1.2bn 10-year scholarship programme","Lagos State University (LASU) signed an MoU with OPay, becoming the latest beneficiary of the fintech's ₦1.2bn 10-Year Scholarship Programme.",https://punchng.com/tags/opay/,21/10/2025,Punch,Opay,133000,,
"Service Review: OPay’s approach to secure payments for its over 60 million users","A detailed review of OPay's new suite of 7 security features launched to address customer pain points like fraud and accidental transfers.",https://nairametrics.com/2025/10/22/service-review-opays-approach-to-secure-payments-for-its-over-60-million-users/,22/10/2025,Nairametrics,Opay,50000,,
"OPay unveils eighth security feature, 'Location Guard', at grand finale of security vote challenge","At the grand finale of its ""My OPay Security Vote Challenge"" in Lagos, OPay unveiled its eighth security feature, ""Location Guard.""",https://punchng.com/tags/opay/,23/10/2025,Punch,Opay,133000,,
"CBN debunks viral news suspending OPay, PalmPay","The Central Bank of Nigeria (CBN) debunked false, viral social media posts claiming it had suspended the operations of OPay and PalmPay.",https://www.premiumtimesng.com/news/more-news/589981-cbn-debunks-viral-news-suspending-opay-palmpay.html,25/10/2025,Premium Times,Opay,19000,,
"OPay set to host Empowering Futures Conference 2025","OPay announced it will host the Empowering Futures Conference 2025 on October 31 in Lagos.",https://punchng.com/opay-set-to-host-empowering-futures-conference-2025/,27/10/2025,Punch,Opay,133000,,
"Opera Reports Third Quarter 2025 Results Ahead of Expectations","Opera's Q3 2025 report shows its ""Investment in OPay"" is valued at $258.3 million.",https://investor.opera.com/news-releases/news-release-details/opera-reports-third-quarter-2025-results-ahead-expectations/,29/10/2025,Investor Opera,Opay,1070,,
"OPay disburse ₦126 million to 420 students","At the OPay Empowering Futures Conference 2025 on Oct 31, OPay celebrated the completion of Year 1 of its 10-year, ₦1.2B scholarship.",https://techpoint.africa/coverage/opay-disburses-126-million-to-420-students/,31/10/2025,Techpoint Africa,Opay,24000,,
"OPay disburses N126 million in scholarships, targets N1.2 billion for Nigerian students","OPay announced at its 'OPay CSR Empowering Futures 2025' conference that it has disbursed N126 million to 420 students in its first year.",https://nairametrics.com/2025/11/01/opay-disburses-n126-million-in-scholarships-targets-n1-2-billion-for-nigerian-students/,01/11/2025,Nairametrics,Opay,51500,,
"OPay, UniCal to establish cybersecurity lab","OPay signed a Memorandum of Understanding (MoU) with the University of Calabar (UniCal) for its cybersecurity lab project.",https://punchng.com/tags/opay/,02/11/2025,Punch,Opay,133000,,
"Yahui Zhou and OPay: Strategic vision reshapes the new ecosystem of digital payments in Africa","An analysis of OPay founder Yahui Zhou's strategic vision.",https://www.barchart.com/story/news/35854100/yahui-zhou-and-opay-strategic-vision-reshapes-the-new-ecosystem-of-digital-payments-in-africa,03/11/2025,Barchart,Opay,23,,
"OPay Celebrates First Year of 10-Year Education Empowerment Initiative","OPay marked the first anniversary of its ""Year 1 of 10"" Education Empowerment Initiative.",https://techafricanews.com/2025/11/03/opay-celebrates-first-year-of-10-year-education-empowerment-initiative/,03/11/2025,Tech Africa News,Opay,25800,,
"MTN's fintech arm growth driven by airtime lending, faces OPay dominance","A report on MTN's fintech arm shows its revenue growth is mostly from airtime lending.",https://techcabal.com/2025/11/04/mtn-fintech-revenue-2025-airtime-lending/,04/11/2025,TechCabal,Opay,21800,,
"HRLeverage Africa's growth accelerated by OPay","In a feature on HRLeverage Africa, its founder mentioned that OPay was one of the key clients that accelerated the HR firm's growth.",https://techpoint.africa/feature/workremits-hrleverage/,11/11/2025,Techpoint Africa,Opay,24000,,
"Access Bank's $100M 'Access for Women' Initiative Hailed by World Bank","Access Bank has received commendation from the World Bank for its 'Access for Women' initiative.",https://accessbank.com/world-bank-praise,12/10/2025,Access Bank,Access,230000,,
"Access Holdings Plc Q3 2025 Pre-Tax Profit Rises 31%","Access Holdings Plc announced its Q3 2025 financial results, reporting a 31% increase in pre-tax profit.",https://businessday.ng/access-q3-2025-profit,16/10/2025,Business Day,Access,36780,,
"Access Bank Completes Acquisition of Atlas Mara Zambia","Access Bank Plc has formally announced the completion of its acquisition of Atlas Mara Limited in Zambia.",https://bloomberg.com/access-zambia-atlas-mara,19/10/2025,Bloomberg,Access,120000,,
"Access Bank Launches New 'AccessMore' Feature for Cross-Border Payments","The AccessMore app has been upgraded with a new feature facilitating seamless cross-border payments.",https://vanguardngr.com/accessmore-new-feature,25/10/2025,Vanguard,Access,201890,,
"Why Analysts Rate Access Holdings (ACCESS) a 'Buy' After Q3 Results","Following the strong Q3 2025 results, financial analysts have reiterated a 'Buy' rating for Access Holdings.",https://nairametrics.com/access-buy-rating,17/10/2025,Nairametrics,Access,43000,,
"Customers Complain of 'Excessive' Account Maintenance Fees","A social media trend has seen numerous Access Bank customers voicing frustration over ""excessive 'Account Maintenance Fees'"" being debited.",https://twitter.com/trend/access-fees,22/10/2025,Twitter,Access,20000,,
"Access Bank Kenya Q3 Profit Hits KES 12.8 Billion","Access Bank's Kenyan subsidiary posted a strong Q3 performance, with profit before tax rising to KES 12.8 billion.",https://the-star.co.ke/access-kenya-q3,27/10/2025,The Star,Access,50,,
"Access Bank Partners with PayStack to Boost Merchant Services","Access Bank announced a strategic partnership with fintech giant PayStack to integrate advanced payment solutions.",https://techcrunch.com/access-paystack-deal,28/10/2025,Tech Crunch,Access,70,,
"Access Bank GCEO Advocates for Pan-African Financial Integration at Lagos Summit","The Group CEO of Access Holdings, speaking at the Lagos Economic Summit, called for deeper regulatory harmonization.",https://thisdaylive.com/gceo-lagos-summit,30/10/2025,Thisdaylive,Access,120000,,
"""Our African Ambition is Long-Term,"" says Access GCEO","In an exclusive interview, the Access Holdings GCEO discussed the bank's long-term M&A strategy.",https://financialtimes.com/access-gceo-interview,02/11/2025,Financial Africa,Access,15000,,
"Access Bank Named 'Best Bank for Sustainable Finance' in Africa 2025","Global Finance has named Access Bank as the 'Best Bank for Sustainable Finance' in Africa for 2025.",https://globalfinance.com/awards-2025,07/11/2025,Global Financial,Access,20000,,
"Access Holdings Stock Dips 2.5% Despite Strong Q3 Profits","Shares of Access Holdings Plc fell 2.5% in trading on Oct 17, a day after releasing strong Q3 2025 profit numbers.",https://proactiveinvestors.com/access-stock-dip,17/10/2025,Proactive Investors,Access,2600,,
"Access Bank's 'AccessMore' App Faces Weekend-Long Downtime, Sparks Outcry","Customers of Access Bank were left stranded as the 'AccessMore' mobile app and USSD services faced a near 48-hour downtime.",https://techcabal.com/accessmore-downtime,04/11/2025,Tech Cabal,Access,21000,,
"""Failed Transaction But Debited"": Access Bank Customers Lament Poor Service","A common refrain on social media involves Access Bank customers lamenting instances of ""failed transaction but debited.""",https://naijatech.com/access-failed-transactions,10/11/2025,Naija Tech